Number_added,Name_orginial,Author,Reviews_count,User_rating,Price,Year,Genre,Title_upper,Series,Series_number,Author_upper,LastName_first_no_titlesDRJR,Audience,Adult_interest,Title_word_count,Author_count_all,Authors_last_three
532,"Wheat Belly: Lose the Wheat, Lose the Weight, and Find Your Path Back to Health",William Davis,"7,497",4.4,$6.00,2012,Non Fiction,"WHEAT BELLY: LOSE THE WHEAT, LOSE THE WEIGHT, AND FIND YOUR PATH BACK TO HEALTH",(blank),,WILLIAM DAVIS,"DAVIS, WILLIAM",Adult,Adult,15,2,0
533,"Wheat Belly: Lose the Wheat, Lose the Weight, and Find Your Path Back to Health",William Davis,"7,497",4.4,$6.00,2013,Non Fiction,"WHEAT BELLY: LOSE THE WHEAT, LOSE THE WEIGHT, AND FIND YOUR PATH BACK TO HEALTH",(blank),,WILLIAM DAVIS,"DAVIS, WILLIAM",Adult,Adult,15,2,0
361,The Day the Crayons Quit,Drew Daywalt,"8,922",4.8,$9.00,2013,Fiction,THE DAY THE CRAYONS QUIT,(blank),,DREW DAYWALT,"DAYWALT, DREW",CH,Not_adult,5,3,0
362,The Day the Crayons Quit,Drew Daywalt,"8,922",4.8,$9.00,2014,Fiction,THE DAY THE CRAYONS QUIT,(blank),,DREW DAYWALT,"DAYWALT, DREW",CH,Not_adult,5,3,0
363,The Day the Crayons Quit,Drew Daywalt,"8,922",4.8,$9.00,2015,Fiction,THE DAY THE CRAYONS QUIT,(blank),,DREW DAYWALT,"DAYWALT, DREW",CH,Not_adult,5,3,0
359,The Constitution of the United States,Delegates of the Constitutional,"2,774",4.8,$14.84,2016,Non Fiction,THE CONSTITUTION OF THE UNITED STATES,(blank),,DELEGATES OF THE CONSTITUTIONAL,DELEGATES OF THE CONSTITUTIONAL CONGRESS,Adult,Adult,6,1,0
546,"Wrecking Ball: Diary of a Wimpy Kid, Book 14 (Diary of a Wimpy Kid)",Jeff Kinney,"9,413",4.9,$8.00,2019,Fiction,WRECKING BALL: DIARY OF A WIMPY KID,Diary of a Wimpy Kid,14,JEFF KINNEY,"KINNEY, JEFF",CH,Not_adult,12,12,12
504,Thug Kitchen: The Official Cookbook: Eat Like You Give a F*ck (Thug Kitchen Cookbooks),Thug Kitchen,"11,128",4.6,$23.00,2017,Non Fiction,THUG KITCHEN: THE OFFICIAL COOKBOOK: EAT LIKE YOU GIVE A F*CK,Thug Kitchen Cookbooks,,THUG KITCHEN,"KITCHEN, THUG",Adult,Adult,14,4,4
29,Baby Touch and Feel: Animals,DK,"5,360",4.6,$5.00,2015,Non Fiction,BABY TOUCH AND FEEL: ANIMALS,(blank),,DK,DK,CH,Not_adult,5,2,0
515,Ultimate Sticker Book: Frozen: More Than 60 Reusable Full-Color Stickers,DK,"2,586",4.5,$5.00,2014,Fiction,ULTIMATE STICKER BOOK: FROZEN: MORE THAN 60 REUSABLE FULL-COLOR STICKERS,(blank),,DK,DK,CH,Not_adult,10,2,0
21,All the Light We Cannot See,Anthony Doerr,"36,348",4.6,$14.00,2014,Fiction,ALL THE LIGHT WE CANNOT SEE,(blank),,ANTHONY DOERR,"DOERR, ANTHONY",Adult,Adult,6,2,0
22,All the Light We Cannot See,Anthony Doerr,"36,348",4.6,$14.00,2015,Fiction,ALL THE LIGHT WE CANNOT SEE,(blank),,ANTHONY DOERR,"DOERR, ANTHONY",Adult,Adult,6,2,0
447,"The Pioneer Woman Cooks: A Year of Holidays: 140 Step-by-Step Recipes for Simple, Scrumptious Celebrations",Ree Drummond,"2,663",4.8,$17.00,2013,Non Fiction,"THE PIONEER WOMAN COOKS: A YEAR OF HOLIDAYS: 140 STEP-BY-STEP RECIPES FOR SIMPLE, SCRUMPTIOUS CELEBRATIONS",(Pioneer Woman),,REE DRUMMOND,"DRUMMOND, REE",Adult,Adult,15,3,0
448,"The Pioneer Woman Cooks: Dinnertime - Comfort Classics, Freezer Food, 16-minute Meals, and Other Delicious Ways to Solve…",Ree Drummond,"3,428",4.8,$14.00,2015,Non Fiction,"THE PIONEER WOMAN COOKS: DINNERTIME - COMFORT CLASSICS, FREEZER FOOD, 16-MINUTE MEALS, AND OTHER DELICIOUS WAYS TO SOLVE…",(Pioneer Woman),,REE DRUMMOND,"DRUMMOND, REE",Adult,Adult,18,3,0
449,The Pioneer Woman Cooks: Food from My Frontier,Ree Drummond,"2,876",4.8,$21.00,2012,Non Fiction,THE PIONEER WOMAN COOKS: FOOD FROM MY FRONTIER,(Pioneer Woman),,REE DRUMMOND,"DRUMMOND, REE",Adult,Adult,8,3,0
13,A Stolen Life: A Memoir,Jaycee Dugard,"4,149",4.6,$32.00,2011,Non Fiction,A STOLEN LIFE: A MEMOIR,(blank),,JAYCEE DUGARD,"DUGARD, JAYCEE",Adult,Adult,5,1,0
454,The Power of Habit: Why We Do What We Do in Life and Business,Charles Duhigg,"10,795",4.6,$21.00,2012,Non Fiction,THE POWER OF HABIT: WHY WE DO WHAT WE DO IN LIFE AND BUSINESS,(blank),,CHARLES DUHIGG,"DUHIGG, CHARLES",Adult,Adult,14,1,0
364,"The Dukan Diet: 2 Steps to Lose the Weight, 2 Steps to Keep It Off Forever",Pierre Dukan,"2,023",4.1,$15.00,2011,Non Fiction,"THE DUKAN DIET: 2 STEPS TO LOSE THE WEIGHT, 2 STEPS TO KEEP IT OFF FOREVER",(blank),,PIERRE DUKAN,"DUKAN, PIERRE",Adult,Adult,16,1,0
234,Mindset: The New Psychology of Success,Carol S. Dweck,"5,542",4.6,$10.00,2014,Non Fiction,MINDSET: THE NEW PSYCHOLOGY OF SUCCESS,(blank),,CAROL S. DWECK,"DWECK, S. CAROL",Adult,Adult,6,3,0
235,Mindset: The New Psychology of Success,Carol S. Dweck,"5,542",4.6,$10.00,2015,Non Fiction,MINDSET: THE NEW PSYCHOLOGY OF SUCCESS,(blank),,CAROL S. DWECK,"DWECK, S. CAROL",Adult,Adult,6,3,0
236,Mindset: The New Psychology of Success,Carol S. Dweck,"5,542",4.6,$10.00,2016,Non Fiction,MINDSET: THE NEW PSYCHOLOGY OF SUCCESS,(blank),,CAROL S. DWECK,"DWECK, S. CAROL",Adult,Adult,6,3,0
205,Knock-Knock Jokes for Kids,Rob Elliott,"3,673",4.5,$4.00,2013,Non Fiction,KNOCK-KNOCK JOKES FOR KIDS,Laugh-Out-Loud Jokes for Kids,,ROB ELLIOTT,"ELLIOTT, ROB",CH,Not_adult,4,8,0
206,Knock-Knock Jokes for Kids,Rob Elliott,"3,673",4.5,$4.00,2014,Non Fiction,KNOCK-KNOCK JOKES FOR KIDS,Laugh-Out-Loud Jokes for Kids,,ROB ELLIOTT,"ELLIOTT, ROB",CH,Not_adult,4,8,0
207,Knock-Knock Jokes for Kids,Rob Elliott,"3,673",4.5,$4.00,2015,Non Fiction,KNOCK-KNOCK JOKES FOR KIDS,Laugh-Out-Loud Jokes for Kids,,ROB ELLIOTT,"ELLIOTT, ROB",CH,Not_adult,4,8,0
209,Laugh-Out-Loud Jokes for Kids,Rob Elliott,"6,990",4.6,$4.00,2013,Non Fiction,LAUGH-OUT-LOUD JOKES FOR KIDS,Laugh-Out-Loud Jokes for Kids,,ROB ELLIOTT,"ELLIOTT, ROB",CH,Not_adult,4,8,0
210,Laugh-Out-Loud Jokes for Kids,Rob Elliott,"6,990",4.6,$4.00,2014,Non Fiction,LAUGH-OUT-LOUD JOKES FOR KIDS,Laugh-Out-Loud Jokes for Kids,,ROB ELLIOTT,"ELLIOTT, ROB",CH,Not_adult,4,8,0
211,Laugh-Out-Loud Jokes for Kids,Rob Elliott,"6,990",4.6,$4.00,2015,Non Fiction,LAUGH-OUT-LOUD JOKES FOR KIDS,Laugh-Out-Loud Jokes for Kids,,ROB ELLIOTT,"ELLIOTT, ROB",CH,Not_adult,4,8,0
212,Laugh-Out-Loud Jokes for Kids,Rob Elliott,"6,990",4.6,$4.00,2016,Non Fiction,LAUGH-OUT-LOUD JOKES FOR KIDS,Laugh-Out-Loud Jokes for Kids,,ROB ELLIOTT,"ELLIOTT, ROB",CH,Not_adult,4,8,0
263,P is for Potty! (Sesame Street) (Lift-the-Flap),Naomi Kleinberg,"10,820",4.7,$5.00,2018,Non Fiction,P IS FOR POTTY!,"Sesame Street, Lift-the-Flap",,NAOMI KLEINBERG,"KLEINBERG, NAOMI",CH,Not_adult,7,2,2
320,"The 4 Hour Body: An Uncommon Guide to Rapid Fat Loss, Incredible Sex and Becoming Superhuman",Timothy Ferriss,"4,587",4.3,$21.00,2011,Non Fiction,"THE 4 HOUR BODY: AN UNCOMMON GUIDE TO RAPID FAT LOSS, INCREDIBLE SEX AND BECOMING SUPERHUMAN",(blank),,TIMOTHY FERRISS,"FERRISS, TIMOTHY",Adult,Adult,16,2,0
264,P is for Potty! (Sesame Street) (Lift-the-Flap),Naomi Kleinberg,"10,820",4.7,$5.00,2019,Non Fiction,P IS FOR POTTY!,"Sesame Street, Lift-the-Flap",,NAOMI KLEINBERG,"KLEINBERG, NAOMI",CH,Not_adult,7,2,2
505,Tina Fey: Bossypants,Tina Fey,"5,977",4.3,$12.00,2011,Non Fiction,TINA FEY: BOSSYPANTS,(blank),,TINA FEY,"FEY, TINA",Adult,Adult,3,1,0
395,The Great Gatsby,F. Scott Fitzgerald,"11,616",4.4,$7.00,2012,Fiction,THE GREAT GATSBY,(blank),,F. SCOTT FITZGERALD,"FITZGERALD, SCOTT F.",Adult,Adult,3,3,0
396,The Great Gatsby,F. Scott Fitzgerald,"11,616",4.4,$7.00,2013,Fiction,THE GREAT GATSBY,(blank),,F. SCOTT FITZGERALD,"FITZGERALD, SCOTT F.",Adult,Adult,3,3,0
397,The Great Gatsby,F. Scott Fitzgerald,"11,616",4.4,$7.00,2014,Fiction,THE GREAT GATSBY,(blank),,F. SCOTT FITZGERALD,"FITZGERALD, SCOTT F.",Adult,Adult,3,3,0
136,Gone Girl,Gillian Flynn,"57,271",4.0,$10.00,2012,Fiction,GONE GIRL,(blank),,GILLIAN FLYNN,"FLYNN, GILLIAN",Adult,Adult,2,3,0
137,Gone Girl,Gillian Flynn,"57,271",4.0,$10.00,2013,Fiction,GONE GIRL,(blank),,GILLIAN FLYNN,"FLYNN, GILLIAN",Adult,Adult,2,3,0
138,Gone Girl,Gillian Flynn,"57,271",4.0,$9.00,2014,Fiction,GONE GIRL,(blank),,GILLIAN FLYNN,"FLYNN, GILLIAN",Adult,Adult,2,3,0
539,Winter of the World: Book Two of the Century Trilogy,Ken Follett,"10,760",4.5,$15.00,2012,Fiction,WINTER OF THE WORLD: BOOK TWO OF THE CENTURY TRILOGY,(blank),,KEN FOLLETT,"FOLLETT, KEN",Adult,Adult,10,1,0
181,If I Stay,Gayle Forman,"7,153",4.3,$9.00,2014,Fiction,IF I STAY,(blank),,GAYLE FORMAN,"FORMAN, GAYLE",YA,Not_adult,3,1,0
94,"Eat to Live: The Amazing Nutrient-Rich Program for Fast and Sustained Weight Loss, Revised Edition",Joel Fuhrman MD,"6,346",4.5,$9.00,2011,Non Fiction,"EAT TO LIVE: THE AMAZING NUTRIENT-RICH PROGRAM FOR FAST AND SUSTAINED WEIGHT LOSS, REVISED EDITION",(blank),,JOEL FUHRMAN,"FUHRMAN, JOEL",Adult,Adult,15,2,0
95,"Eat to Live: The Amazing Nutrient-Rich Program for Fast and Sustained Weight Loss, Revised Edition",Joel Fuhrman MD,"6,346",4.5,$9.00,2012,Non Fiction,"EAT TO LIVE: THE AMAZING NUTRIENT-RICH PROGRAM FOR FAST AND SUSTAINED WEIGHT LOSS, REVISED EDITION",(blank),,JOEL FUHRMAN,"FUHRMAN, JOEL",Adult,Adult,15,2,0
432,The Magnolia Story,Chip Gaines,"7,861",4.9,$5.00,2016,Non Fiction,THE MAGNOLIA STORY,(blank),,CHIP GAINES,"GAINES, CHIP",Adult,Adult,3,1,0
426,The Life-Changing Magic of Tidying Up: The Japanese Art of Decluttering and Organizing,Marie Kondō,"22,641",4.5,$11.00,2017,Non Fiction,THE LIFE-CHANGING MAGIC OF TIDYING UP: THE JAPANESE ART OF DECLUTTERING AND ORGANIZING,(blank),,MARIE KONDŌ,"KONDŌ, MARIE",Adult,Adult,13,4,4
427,The Life-Changing Magic of Tidying Up: The Japanese Art of Decluttering and Organizing,Marie Kondō,"22,641",4.5,$11.00,2019,Non Fiction,THE LIFE-CHANGING MAGIC OF TIDYING UP: THE JAPANESE ART OF DECLUTTERING AND ORGANIZING,(blank),,MARIE KONDŌ,"KONDŌ, MARIE",Adult,Adult,13,4,4
331,The 5000 Year Leap,W. Cleon Skousen,"1,680",4.8,$12.00,2009,Non Fiction,THE 5000 YEAR LEAP,(blank),,W. CLEON SKOUSEN,"SKOUSEN, CLEON W.",Adult,Adult,4,1,0
306,StrengthsFinder 2.0,Gallup,"5,069",4.0,$17.00,2010,Non Fiction,STRENGTHSFINDER 2.0,(blank),,GALLUP,GALLUP,Adult,Adult,2,9,0
307,StrengthsFinder 2.0,Gallup,"5,069",4.0,$17.00,2011,Non Fiction,STRENGTHSFINDER 2.0,(blank),,GALLUP,GALLUP,Adult,Adult,2,9,0
308,StrengthsFinder 2.0,Gallup,"5,069",4.0,$17.00,2012,Non Fiction,STRENGTHSFINDER 2.0,(blank),,GALLUP,GALLUP,Adult,Adult,2,9,0
309,StrengthsFinder 2.0,Gallup,"5,069",4.0,$17.00,2013,Non Fiction,STRENGTHSFINDER 2.0,(blank),,GALLUP,GALLUP,Adult,Adult,2,9,0
310,StrengthsFinder 2.0,Gallup,"5,069",4.0,$17.00,2014,Non Fiction,STRENGTHSFINDER 2.0,(blank),,GALLUP,GALLUP,Adult,Adult,2,9,0
311,StrengthsFinder 2.0,Gallup,"5,069",4.0,$17.00,2015,Non Fiction,STRENGTHSFINDER 2.0,(blank),,GALLUP,GALLUP,Adult,Adult,2,9,0
312,StrengthsFinder 2.0,Gallup,"5,069",4.0,$17.00,2016,Non Fiction,STRENGTHSFINDER 2.0,(blank),,GALLUP,GALLUP,Adult,Adult,2,9,0
54,Crazy Rich Asians (Crazy Rich Asians Trilogy),Kevin Kwan,"6,143",4.3,$8.00,2018,Fiction,CRAZY RICH ASIANS,Crazy Rich Asians Trilogy,1,KEVIN KWAN,"KWAN, KEVIN",Adult,Adult,7,1,1
31,Barefoot Contessa Foolproof: Recipes You Can Trust: A Cookbook,Ina Garten,"1,296",4.8,$24.00,2012,Non Fiction,BAREFOOT CONTESSA FOOLPROOF: RECIPES YOU CAN TRUST: A COOKBOOK,Barefoot Contessa,,INA GARTEN,"GARTEN, INA",Adult,Adult,9,3,0
32,"Barefoot Contessa, How Easy Is That?: Fabulous Recipes & Easy Tips",Ina Garten,615,4.7,$21.00,2010,Non Fiction,"BAREFOOT CONTESSA, HOW EASY IS THAT?: FABULOUS RECIPES & EASY TIPS",Barefoot Contessa,,INA GARTEN,"GARTEN, INA",Adult,Adult,11,3,0
227,Make It Ahead: A Barefoot Contessa Cookbook,Ina Garten,"1,386",4.5,$20.00,2014,Non Fiction,MAKE IT AHEAD: A BAREFOOT CONTESSA COOKBOOK,Barefoot Contessa,,INA GARTEN,"GARTEN, INA",Adult,Adult,7,3,0
14,A Wrinkle in Time (Time Quintet),Madeleine L'Engle,"5,153",4.5,$5.00,2018,Fiction,A WRINKLE IN TIME,Time Quintet,1,MADELEINE L'ENGLE,"L'ENGLE, MADELEINE",CH,Not_adult,6,1,1
35,Being Mortal: Medicine and What Matters in the End,Atul Gawande,"11,113",4.8,$15.00,2015,Non Fiction,BEING MORTAL: MEDICINE AND WHAT MATTERS IN THE END,(blank),,ATUL GAWANDE,"GAWANDE, ATUL",Adult,Adult,9,1,0
60,"David and Goliath: Underdogs, Misfits, and the Art of Battling Giants",Malcolm Gladwell,"4,642",4.4,$13.00,2013,Non Fiction,"DAVID AND GOLIATH: UNDERDOGS, MISFITS, AND THE ART OF BATTLING GIANTS",(blank),,MALCOLM GLADWELL,"GLADWELL, MALCOLM",Adult,Adult,11,4,0
332,The 7 Habits of Highly Effective People: Powerful Lessons in Personal Change,Stephen R. Covey,"9,325",4.6,$24.00,2009,Non Fiction,THE 7 HABITS OF HIGHLY EFFECTIVE PEOPLE: POWERFUL LESSONS IN PERSONAL CHANGE,(blank),,STEPHEN R. COVEY,"COVEY, R. STEPHEN",Adult,Adult,12,7,0
262,Outliers: The Story of Success,Malcolm Gladwell,"10,426",4.6,$20.00,2010,Non Fiction,OUTLIERS: THE STORY OF SUCCESS,(blank),,MALCOLM GLADWELL,"GLADWELL, MALCOLM",Adult,Adult,5,4,0
347,The Book of Basketball: The NBA According to The Sports Guy,Bill Simmons,858,4.7,$53.00,2009,Non Fiction,THE BOOK OF BASKETBALL: THE NBA ACCORDING TO THE SPORTS GUY,(blank),,BILL SIMMONS,"SIMMONS, BILL",Adult,Adult,11,1,0
510,To Kill a Mockingbird,Harper Lee,"26,234",4.8,$7.00,2019,Fiction,TO KILL A MOCKINGBIRD,(blank),,HARPER LEE,"LEE, HARPER",Adult,Adult,4,6,6
522,Unfreedom of the Press,Mark R. Levin,"5,956",4.9,$11.00,2019,Non Fiction,UNFREEDOM OF THE PRESS,(blank),,MARK R. LEVIN,"LEVIN, R. MARK",Adult,Adult,4,2,2
530,What Should Danny Do? (The Power to Choose Series),Adir Levy,"8,170",4.8,$13.00,2019,Fiction,WHAT SHOULD DANNY DO?,The Power to Choose Series,,ADIR LEVY,"LEVY, ADIR",CH,Not_adult,9,1,1
222,Looking for Alaska,John Green,"8,491",4.5,$7.00,2014,Fiction,LOOKING FOR ALASKA,(blank),,JOHN GREEN,"GREEN, JOHN",YA,Not_adult,3,5,0
366,The Fault in Our Stars,John Green,"50,482",4.7,$13.00,2012,Fiction,THE FAULT IN OUR STARS,(blank),,JOHN GREEN,"GREEN, JOHN",YA,Not_adult,5,5,0
367,The Fault in Our Stars,John Green,"50,482",4.7,$13.00,2013,Fiction,THE FAULT IN OUR STARS,(blank),,JOHN GREEN,"GREEN, JOHN",YA,Not_adult,5,5,0
368,The Fault in Our Stars,John Green,"50,482",4.7,$7.00,2014,Fiction,THE FAULT IN OUR STARS,(blank),,JOHN GREEN,"GREEN, JOHN",YA,Not_adult,5,5,0
369,The Fault in Our Stars,John Green,"50,482",4.7,$13.00,2014,Fiction,THE FAULT IN OUR STARS,(blank),,JOHN GREEN,"GREEN, JOHN",YA,Not_adult,5,5,0
358,The Confession: A Novel,John Grisham,"3,523",4.3,$13.00,2010,Fiction,THE CONFESSION: A NOVEL,(blank),,JOHN GRISHAM,"GRISHAM, JOHN",Adult,Adult,4,5,0
465,The Subtle Art of Not Giving a F*ck: A Counterintuitive Approach to Living a Good Life,Mark Manson,"26,490",4.6,$15.00,2017,Non Fiction,THE SUBTLE ART OF NOT GIVING A F*CK: A COUNTERINTUITIVE APPROACH TO LIVING A GOOD LIFE,(blank),,MARK MANSON,"MANSON, MARK",Adult,Adult,16,3,3
428,The Litigators,John Grisham,"6,222",4.4,$18.00,2011,Fiction,THE LITIGATORS,(blank),,JOHN GRISHAM,"GRISHAM, JOHN",Adult,Adult,2,5,0
456,The Racketeer,John Grisham,"14,493",4.3,$18.00,2012,Fiction,THE RACKETEER,(blank),,JOHN GRISHAM,"GRISHAM, JOHN",Adult,Adult,2,5,0
526,Water for Elephants: A Novel,Sara Gruen,"8,958",4.5,$12.00,2011,Fiction,WATER FOR ELEPHANTS: A NOVEL,(blank),,SARA GRUEN,"GRUEN, SARA",Adult,Adult,5,1,0
466,The Subtle Art of Not Giving a F*ck: A Counterintuitive Approach to Living a Good Life,Mark Manson,"26,490",4.6,$15.00,2018,Non Fiction,THE SUBTLE ART OF NOT GIVING A F*CK: A COUNTERINTUITIVE APPROACH TO LIVING A GOOD LIFE,(blank),,MARK MANSON,"MANSON, MARK",Adult,Adult,16,3,3
467,The Subtle Art of Not Giving a F*ck: A Counterintuitive Approach to Living a Good Life,Mark Manson,"26,490",4.6,$15.00,2019,Non Fiction,THE SUBTLE ART OF NOT GIVING A F*CK: A COUNTERINTUITIVE APPROACH TO LIVING A GOOD LIFE,(blank),,MARK MANSON,"MANSON, MARK",Adult,Adult,16,3,3
297,Sh*t My Dad Says,Justin Halpern,"1,265",4.7,$11.00,2010,Non Fiction,SH*T MY DAD SAYS,(blank),,JUSTIN HALPERN,"HALPERN, JUSTIN",Adult,Adult,4,1,0
438,The Nightingale: A Novel,Kristin Hannah,"49,288",4.8,$11.00,2015,Fiction,THE NIGHTINGALE: A NOVEL,(blank),,KRISTIN HANNAH,"HANNAH, KRISTIN",Adult,Adult,4,2,0
439,The Nightingale: A Novel,Kristin Hannah,"49,288",4.8,$11.00,2016,Fiction,THE NIGHTINGALE: A NOVEL,(blank),,KRISTIN HANNAH,"HANNAH, KRISTIN",Adult,Adult,4,2,0
365,The Elegance of the Hedgehog,Muriel Barbery,"1,859",4.0,$11.00,2009,Fiction,THE ELEGANCE OF THE HEDGEHOG,(blank),,MURIEL BARBERY,"BARBERY, MURIEL",Adult,Adult,5,1,0
383,The Girl on the Train,Paula Hawkins,"79,446",4.1,$18.00,2015,Fiction,THE GIRL ON THE TRAIN,(blank),,PAULA HAWKINS,"HAWKINS, PAULA",Adult,Adult,5,2,0
384,The Girl on the Train,Paula Hawkins,"79,446",4.1,$7.00,2016,Fiction,THE GIRL ON THE TRAIN,(blank),,PAULA HAWKINS,"HAWKINS, PAULA",Adult,Adult,5,2,0
315,Switch: How to Change Things When Change Is Hard,Chip Heath,"1,907",4.6,$13.00,2010,Non Fiction,SWITCH: HOW TO CHANGE THINGS WHEN CHANGE IS HARD,(blank),,CHIP HEATH,"HEATH, CHIP",Adult,Adult,9,1,0
118,"Game Change: Obama and the Clintons, McCain and Palin, and the Race of a Lifetime",John Heilemann,"1,215",4.4,$9.00,2010,Non Fiction,"GAME CHANGE: OBAMA AND THE CLINTONS, MCCAIN AND PALIN, AND THE RACE OF A LIFETIME",(blank),,JOHN HEILEMANN,"HEILEMANN, JOHN",Adult,Adult,15,1,0
516,"Unbroken: A World War II Story of Survival, Resilience, and Redemption",Laura Hillenbrand,"29,673",4.8,$16.00,2010,Non Fiction,"UNBROKEN: A WORLD WAR II STORY OF SURVIVAL, RESILIENCE, AND REDEMPTION",(blank),,LAURA HILLENBRAND,"HILLENBRAND, LAURA",Adult,Adult,11,5,0
517,"Unbroken: A World War II Story of Survival, Resilience, and Redemption",Laura Hillenbrand,"29,673",4.8,$16.00,2011,Non Fiction,"UNBROKEN: A WORLD WAR II STORY OF SURVIVAL, RESILIENCE, AND REDEMPTION",(blank),,LAURA HILLENBRAND,"HILLENBRAND, LAURA",Adult,Adult,11,5,0
518,"Unbroken: A World War II Story of Survival, Resilience, and Redemption",Laura Hillenbrand,"29,673",4.8,$16.00,2012,Non Fiction,"UNBROKEN: A WORLD WAR II STORY OF SURVIVAL, RESILIENCE, AND REDEMPTION",(blank),,LAURA HILLENBRAND,"HILLENBRAND, LAURA",Adult,Adult,11,5,0
519,"Unbroken: A World War II Story of Survival, Resilience, and Redemption",Laura Hillenbrand,"29,673",4.8,$13.00,2014,Non Fiction,"UNBROKEN: A WORLD WAR II STORY OF SURVIVAL, RESILIENCE, AND REDEMPTION",(blank),,LAURA HILLENBRAND,"HILLENBRAND, LAURA",Adult,Adult,11,5,0
520,"Unbroken: A World War II Story of Survival, Resilience, and Redemption",Laura Hillenbrand,"29,673",4.8,$16.00,2014,Non Fiction,"UNBROKEN: A WORLD WAR II STORY OF SURVIVAL, RESILIENCE, AND REDEMPTION",(blank),,LAURA HILLENBRAND,"HILLENBRAND, LAURA",Adult,Adult,11,5,0
42,"Brown Bear, Brown Bear, What Do You See?",Bill Martin Jr.,"14,344",4.9,$5.00,2019,Fiction,"BROWN BEAR, BROWN BEAR, WHAT DO YOU SEE?",(blank),,BILL MARTIN,"MARTIN,  BILL ",CH,Not_adult,8,2,2
41,"Brown Bear, Brown Bear, What Do You See?",Bill Martin Jr.,"14,344",4.9,$5.00,2017,Fiction,"BROWN BEAR, BROWN BEAR, WHAT DO YOU SEE?",(blank),,BILL MARTIN,"MARTIN,  BILL ",CH,Not_adult,8,2,2
488,The Wonderful Things You Will Be,Emily Winfield Martin,"8,842",4.9,$10.00,2017,Fiction,THE WONDERFUL THINGS YOU WILL BE,(blank),,EMILY WINFIELD MARTIN,"MARTIN, WINFIELD EMILY",CH,Not_adult,6,4,4
489,The Wonderful Things You Will Be,Emily Winfield Martin,"8,842",4.9,$10.00,2018,Fiction,THE WONDERFUL THINGS YOU WILL BE,(blank),,EMILY WINFIELD MARTIN,"MARTIN, WINFIELD EMILY",CH,Not_adult,6,4,4
25,And the Mountains Echoed,Khaled Hosseini,"12,159",4.3,$13.00,2013,Fiction,AND THE MOUNTAINS ECHOED,(blank),,KHALED HOSSEINI,"HOSSEINI, KHALED",Adult,Adult,4,1,0
69,"Delivering Happiness: A Path to Profits, Passion, and Purpose",Tony Hsieh,"1,651",4.6,$15.00,2010,Non Fiction,"DELIVERING HAPPINESS: A PATH TO PROFITS, PASSION, AND PURPOSE",(blank),,TONY HSIEH,"HSIEH, TONY",Adult,Adult,9,1,0
345,"The Blood Sugar Solution: The UltraHealthy Program for Losing Weight, Preventing Disease, and Feeling Great Now!",Mark Hyman M.D.,"1,789",4.2,$14.00,2012,Non Fiction,"THE BLOOD SUGAR SOLUTION: THE ULTRAHEALTHY PROGRAM FOR LOSING WEIGHT, PREVENTING DISEASE, AND FEELING GREAT NOW!",(blank),,MARK HYMAN,"HYMAN, MARK",Adult,Adult,16,1,0
490,The Wonderful Things You Will Be,Emily Winfield Martin,"8,842",4.9,$10.00,2019,Fiction,THE WONDERFUL THINGS YOU WILL BE,(blank),,EMILY WINFIELD MARTIN,"MARTIN, WINFIELD EMILY",CH,Not_adult,6,4,4
302,Steve Jobs,Walter Isaacson,"7,827",4.6,$20.00,2011,Non Fiction,STEVE JOBS,(blank),,WALTER ISAACSON,"ISAACSON, WALTER",Adult,Adult,2,3,0
303,Steve Jobs,Walter Isaacson,"7,827",4.6,$20.00,2012,Non Fiction,STEVE JOBS,(blank),,WALTER ISAACSON,"ISAACSON, WALTER",Adult,Adult,2,3,0
105,Fifty Shades Darker,E L James,"23,631",4.4,$7.00,2012,Fiction,FIFTY SHADES DARKER,(blank),,E L JAMES,"JAMES, L E",Adult,Adult,3,6,0
495,"Thinking, Fast and Slow",Daniel Kahneman,"11,034",4.6,$19.00,2011,Non Fiction,"THINKING, FAST AND SLOW",(blank),,DANIEL KAHNEMAN,"KAHNEMAN, DANIEL",Adult,Adult,4,2,0
496,"Thinking, Fast and Slow",Daniel Kahneman,"11,034",4.6,$19.00,2012,Non Fiction,"THINKING, FAST AND SLOW",(blank),,DANIEL KAHNEMAN,"KAHNEMAN, DANIEL",Adult,Adult,4,2,0
534,When Breath Becomes Air,Paul Kalanithi,"13,779",4.8,$14.00,2016,Non Fiction,WHEN BREATH BECOMES AIR,(blank),,PAUL KALANITHI,"KALANITHI, PAUL",Adult,Adult,4,1,0
230,Milk and Honey,Rupi Kaur,"17,739",4.7,$8.00,2016,Non Fiction,MILK AND HONEY,(blank),,RUPI KAUR,"KAUR, RUPI",Adult,Adult,3,4,0
228,Make Your Bed: Little Things That Can Change Your Life...And Maybe the World,Admiral William H. McRaven,"10,199",4.7,$11.00,2017,Non Fiction,MAKE YOUR BED: LITTLE THINGS THAT CAN CHANGE YOUR LIFE...AND MAYBE THE WORLD,(blank),,ADMIRAL WILLIAM H. MCRAVEN,"MCRAVEN, WILLIAM H.",Adult,Adult,13,1,1
463,The Silent Patient,Alex Michaelides,"27,536",4.5,$14.00,2019,Fiction,THE SILENT PATIENT,(blank),,ALEX MICHAELIDES,"MICHAELIDES, ALEX",Adult,Adult,3,1,1
5,"5,000 Awesome Facts (About Everything!) (National Geographic Kids)",National Geographic Kids,"7,665",4.8,$12.00,2019,Non Fiction,"5,000 AWSOME FACTS (ABOUT EVERYTHING)",National Geographic Kids,,NATIONAL GEOGRAPHIC KIDS,NATIONAL GEOGRAPHIC KIDS,CH,Not_adult,1,1,1
2,11/22/63: A Novel,Stephen King,"2,052",4.6,$22.00,2011,Fiction,11/22/63: A NOVEL,(blank),,STEPHEN KENDRICK,"KENDRICK, STEPHEN",Adult,Adult,3,4,0
80,Doctor Sleep: A Novel,Stephen King,"15,845",4.7,$13.00,2013,Fiction,DOCTOR SLEEP: A NOVEL,(blank),,STEPHEN KENDRICK,"KENDRICK, STEPHEN",Adult,Adult,4,4,0
370,The Five Dysfunctions of a Team: A Leadership Fable,Patrick Lencioni,"3,207",4.6,$6.00,2009,Non Fiction,THE FIVE DYSFUNCTIONS OF A TEAM: A LEADERSHIP FABLE,(blank),,PATRICK LENCIONI,"LENCIONI, PATRICK",Adult,Adult,9,5,0
375,The Five Love Languages: How to Express Heartfelt Commitment to Your Mate,Gary Chapman,803,4.6,$9.00,2009,Non Fiction,THE FIVE LOVE LANGUAGES: HOW TO EXPRESS HEARTFELT COMMITMENT TO YOUR MATE,5 Love Languages,,GARY CHAPMAN,"CHAPMAN, GARY",Adult,Adult,12,11,0
388,The Girl Who Played with Fire (Millennium Series),Stieg Larsson,"7,251",4.7,$16.00,2009,Fiction,THE GIRL WHO PLAYED WITH FIRE,Millennium Series,2,STIEG LARSSON,"LARSSON, STIEG",Adult,Adult,8,6,0
123,George Washington's Secret Six: The Spy Ring That Saved the American Revolution,Brian Kilmeade,"4,799",4.6,$16.00,2013,Non Fiction,GEORGE WASHINGTON'S SECRET SIX: THE SPY RING THAT SAVED THE AMERICAN REVOLUTION,(blank),,BRIAN KILMEADE,"KILMEADE, BRIAN",Adult,Adult,12,1,0
74,"The Long Haul: Diary of a Wimpy Kid, Book 9 (Diary of a Wimpy Kid)",Jeff Kinney,"6,540",4.8,$22.00,2014,Fiction,THE LONG HAUL: DIARY OF A WIMPY KID,Diary of a Wimpy Kid,9,JEFF KINNEY,"KINNEY, JEFF",CH,Not_adult,8,12,0
254,"Old School: Diary of a Wimpy Kid, Book 10 (Diary of a Wimpy Kid)",Jeff Kinney,"6,169",4.8,$7.00,2015,Fiction,OLD SCHOOL: DIARY OF A WIMPY KID DIARY OF A WIMPY KID),Diary of a Wimpy Kid,10,JEFF KINNEY,"KINNEY, JEFF",CH,Not_adult,12,12,0
221,Little Fires Everywhere,Celeste Ng,"25,706",4.5,$12.00,2018,Fiction,LITTLE FIRES EVERYWHERE,(blank),,CELESTE NG,"NG, CELESTE",Adult,Adult,3,1,1
340,The Amateur,Edward Klein,"2,580",4.6,$9.00,2012,Non Fiction,THE AMATEUR,(blank),,EDWARD KLEIN,"KLEIN, EDWARD",Adult,Adult,2,1,0
260,Orphan Train,Christina Baker Kline,"21,930",4.6,$11.00,2014,Fiction,ORPHAN TRAIN,(blank),,CHRISTINA BAKER KLINE,"KLINE, BAKER CHRISTINA",Adult,Adult,2,1,0
424,The Life-Changing Magic of Tidying Up: The Japanese Art of Decluttering and Organizing,Marie Kondō,"22,641",4.5,$11.00,2015,Non Fiction,THE LIFE-CHANGING MAGIC OF TIDYING UP: THE JAPANESE ART OF DECLUTTERING AND ORGANIZING,(blank),,MARIE KONDŌ,"KONDŌ, MARIE",Adult,Adult,13,4,0
425,The Life-Changing Magic of Tidying Up: The Japanese Art of Decluttering and Organizing,Marie Kondō,"22,641",4.5,$11.00,2016,Non Fiction,THE LIFE-CHANGING MAGIC OF TIDYING UP: THE JAPANESE ART OF DECLUTTERING AND ORGANIZING,(blank),,MARIE KONDŌ,"KONDŌ, MARIE",Adult,Adult,13,4,0
292,"Salt, Fat, Acid, Heat: Mastering the Elements of Good Cooking",Samin Nosrat,"7,802",4.8,$20.00,2019,Non Fiction,"SALT, FAT, ACID, HEAT: MASTERING THE ELEMENTS OF GOOD COOKING",(blank),,SAMIN NOSRAT,"NOSRAT, SAMIN",Adult,Adult,10,2,2
291,"Salt, Fat, Acid, Heat: Mastering the Elements of Good Cooking",Samin Nosrat,"7,802",4.8,$20.00,2018,Non Fiction,"SALT, FAT, ACID, HEAT: MASTERING THE ELEMENTS OF GOOD COOKING",(blank),,SAMIN NOSRAT,"NOSRAT, SAMIN",Adult,Adult,10,2,2
494,"Things That Matter: Three Decades of Passions, Pastimes and Politics [Deckled Edge]",Charles Krauthammer,"7,034",4.7,$15.00,2013,Non Fiction,"THINGS THAT MATTER: THREE DECADES OF PASSIONS, PASTIMES AND POLITICS [DECKLED EDGE]",(blank),,CHARLES KRAUTHAMMER,"KRAUTHAMMER, CHARLES",Adult,Adult,12,1,0
24,American Sniper: The Autobiography of the Most Lethal Sniper in U.S. Military History,Chris Kyle,"15,921",4.6,$9.00,2015,Non Fiction,AMERICAN SNIPER: THE AUTOBIOGRAPHY OF THE MOST LETHAL SNIPER IN U.S. MILITARY HISTORY,(blank),,CHRIS KYLE,"KYLE, CHRIS",Adult,Adult,13,1,0
182,"In the Garden of Beasts: Love, Terror, and an American Family in Hitler's Berlin",Eric Larson,"4,571",4.4,$21.00,2011,Non Fiction,"IN THE GARDEN OF BEASTS: LOVE, TERROR, AND AN AMERICAN FAMILY IN HITLER'S BERLIN",(blank),,ERIC LARSON,"LARSON, ERIC",Adult,Adult,14,1,0
