Number_added,Name_orginial,Author,Reviews_count,User_rating,Price,Year,Genre,Title_upper,Series,Series_number,Author_upper,LastName_first_no_titlesDRJR,Audience,Adult_interest,Title_word_count,Author_count_all,Authors_last_three
133,Go Set a Watchman: A Novel,Harper Lee,"14,982",3.6,$19.00,2015,Fiction,GO SET A WATCHMAN: A NOVEL,(blank),,HARPER LEE,"LEE, HARPER",Adult,Adult,6,6,0
506,To Kill a Mockingbird,Harper Lee,"26,234",4.8,$11.38,2013,Fiction,TO KILL A MOCKINGBIRD,(blank),,HARPER LEE,"LEE, HARPER",Adult,Adult,4,6,0
507,To Kill a Mockingbird,Harper Lee,"26,234",4.8,$11.38,2014,Fiction,TO KILL A MOCKINGBIRD,(blank),,HARPER LEE,"LEE, HARPER",Adult,Adult,4,6,0
508,To Kill a Mockingbird,Harper Lee,"26,234",4.8,$11.38,2015,Fiction,TO KILL A MOCKINGBIRD,(blank),,HARPER LEE,"LEE, HARPER",Adult,Adult,4,6,0
509,To Kill a Mockingbird,Harper Lee,"26,234",4.8,$11.38,2016,Fiction,TO KILL A MOCKINGBIRD,(blank),,HARPER LEE,"LEE, HARPER",Adult,Adult,4,6,0
34,Becoming,Michelle Obama,"61,133",4.8,$11.00,2019,Non Fiction,BECOMING,(blank),,MICHELLE OBAMA,"OBAMA, MICHELLE",Adult,Adult,1,2,2
317,Teach Like a Champion: 49 Techniques that Put Students on the Path to College,Doug Lemov,637,4.4,$20.00,2010,Non Fiction,TEACH LIKE A CHAMPION: 49 TECHNIQUES THAT PUT STUDENTS ON THE PATH TO COLLEGE,(blank),,DOUG LEMOV,"LEMOV, DOUG",Adult,Adult,14,2,0
318,Teach Like a Champion: 49 Techniques that Put Students on the Path to College,Doug Lemov,637,4.4,$20.00,2011,Non Fiction,TEACH LIKE A CHAMPION: 49 TECHNIQUES THAT PUT STUDENTS ON THE PATH TO COLLEGE,(blank),,DOUG LEMOV,"LEMOV, DOUG",Adult,Adult,14,2,0
,The Girl Who Played with Fire (Millennium),Stieg Larsson,7251,4.7,16,2009,Fiction,THE GIRL WHO PLAYED WITH FIRE,Millennium Series,2,STIEG LARSSON,"LARSSON, STIEG",Adult,Adult,6,7,0
371,The Five Dysfunctions of a Team: A Leadership Fable,Patrick Lencioni,"3,207",4.6,$6.00,2010,Non Fiction,THE FIVE DYSFUNCTIONS OF A TEAM: A LEADERSHIP FABLE,(blank),,PATRICK LENCIONI,"LENCIONI, PATRICK",Adult,Adult,9,5,0
372,The Five Dysfunctions of a Team: A Leadership Fable,Patrick Lencioni,"3,207",4.6,$6.00,2011,Non Fiction,THE FIVE DYSFUNCTIONS OF A TEAM: A LEADERSHIP FABLE,(blank),,PATRICK LENCIONI,"LENCIONI, PATRICK",Adult,Adult,9,5,0
373,The Five Dysfunctions of a Team: A Leadership Fable,Patrick Lencioni,"3,207",4.6,$6.00,2012,Non Fiction,THE FIVE DYSFUNCTIONS OF A TEAM: A LEADERSHIP FABLE,(blank),,PATRICK LENCIONI,"LENCIONI, PATRICK",Adult,Adult,9,5,0
374,The Five Dysfunctions of a Team: A Leadership Fable,Patrick Lencioni,"3,207",4.6,$6.00,2013,Non Fiction,THE FIVE DYSFUNCTIONS OF A TEAM: A LEADERSHIP FABLE,(blank),,PATRICK LENCIONI,"LENCIONI, PATRICK",Adult,Adult,9,5,0
389,The Girl with the Dragon Tattoo (Millennium Series),Stieg Larsson,"10,559",4.4,$2.00,2009,Fiction,THE GIRL WITH THE DRAGON TATTOO,Millennium Series,1,STIEG LARSSON,"LARSSON, STIEG",Adult,Adult,8,6,0
33,Becoming,Michelle Obama,"61,133",4.8,$11.00,2018,Non Fiction,BECOMING,(blank),,MICHELLE OBAMA,"OBAMA, MICHELLE",Adult,Adult,1,2,2
399,The Guernsey Literary and Potato Peel Pie Society,Mary Ann Shaffer,"8,587",4.7,$10.00,2009,Fiction,THE GUERNSEY LITERARY AND POTATO PEEL PIE SOCIETY,(blank),,MARY ANN SHAFFER,"SHAFFER, ANN MARY",Adult,Adult,8,1,0
343,The Big Short: Inside the Doomsday Machine,Michael Lewis,"3,536",4.7,$17.00,2010,Non Fiction,THE BIG SHORT: INSIDE THE DOOMSDAY MACHINE,(blank),,MICHAEL LEWIS,"LEWIS, MICHAEL",Adult,Adult,7,1,0
122,George Washington's Sacred Fire,Peter A. Lillback,408,4.5,$20.00,2010,Non Fiction,GEORGE WASHINGTON'S SACRED FIRE,(blank),,PETER A. LILLBACK,"LILLBACK, A. PETER",Adult,Adult,4,1,0
422,The Lego Ideas Book: Unlock Your Imagination,Daniel Lipkowitz,"4,247",4.4,$13.00,2011,Non Fiction,THE LEGO IDEAS BOOK: UNLOCK YOUR IMAGINATION,(blank),,DANIEL LIPKOWITZ,"LIPKOWITZ, DANIEL",CH,Not_adult,7,2,0
423,The Lego Ideas Book: Unlock Your Imagination,Daniel Lipkowitz,"4,247",4.4,$13.00,2012,Non Fiction,THE LEGO IDEAS BOOK: UNLOCK YOUR IMAGINATION,(blank),,DANIEL LIPKOWITZ,"LIPKOWITZ, DANIEL",CH,Not_adult,7,2,0
134,Go the F**k to Sleep,Adam Mansbach,"9,568",4.8,$9.00,2011,Fiction,GO THE F**K TO SLEEP,(blank),,ADAM MANSBACH,"MANSBACH, ADAM",Adult,Adult,5,1,0
4,1984 (Signet Classics),George Orwell,"21,424",4.7,$6.00,2017,Fiction,1984,Signet Classics,,GEORGE ORWELL,"ORWELL, GEORGE",Adult,Adult,3,1,1
535,Where the Crawdads Sing,Delia Owens,"87,841",4.8,$15.00,2019,Fiction,WHERE THE CRAWDADS SING,(blank),,DELIA OWENS,"OWENS, DELIA",Adult,Adult,4,1,1
545,Wonder,R. J. Palacio,"21,625",4.8,$9.00,2017,Fiction,WONDER,(blank),,R. J. PALACIO,"PALACIO, J. R.",CH,Not_adult,1,5,5
216,Lettering and Modern Calligraphy: A Beginner's Guide: Learn Hand Lettering and Brush Lettering,Paper Peony Press,"7,550",4.4,$6.00,2018,Non Fiction,LETTERING AND MODERN CALLIGRAPHY: A BEGINNER'S GUIDE: LEARN HAND LETTERING AND BRUSH LETTERING,(blank),,PAPER PEONY PRESS,PAPER PEONY PRESS,Adult,Adult,13,1,1
455,The President Is Missing: A Novel,James Patterson,"10,191",4.3,$18.00,2018,Fiction,THE PRESIDENT IS MISSING: A NOVEL,Bill Clinton & James Patterson stand-alone thrillers,,JAMES PATTERSON,"PATTERSON, JAMES",Adult,Adult,6,2,2
119,Game of Thrones Boxed Set: A Game of Thrones/A Clash of Kings/A Storm of Swords/A Feast for Crows,George R. R. Martin,"5,594",4.6,$5.00,2011,Fiction,GAME OF THRONES BOXED SET: A GAME OF THRONES/A CLASH OF KINGS/A STORM OF SWORDS/A FEAST FOR CROWS,A Song of Ice and Fire,,GEORGE R. R. MARTIN,"MARTIN, GEORGE R. R.",Adult,Adult,18,3,0
120,Game of Thrones Boxed Set: A Game of Thrones/A Clash of Kings/A Storm of Swords/A Feast for Crows,George R. R. Martin,"5,594",4.6,$5.00,2012,Fiction,GAME OF THRONES BOXED SET: A GAME OF THRONES/A CLASH OF KINGS/A STORM OF SWORDS/A FEAST FOR CROWS,A Song of Ice and Fire,,GEORGE R. R. MARTIN,"MARTIN, GEORGE R. R.",Adult,Adult,18,3,0
121,Game of Thrones Boxed Set: A Game of Thrones/A Clash of Kings/A Storm of Swords/A Feast for Crows,George R. R. Martin,"5,594",4.6,$5.00,2013,Fiction,GAME OF THRONES BOXED SET: A GAME OF THRONES/A CLASH OF KINGS/A STORM OF SWORDS/A FEAST FOR CROWS,A Song of Ice and Fire,,GEORGE R. R. MARTIN,"MARTIN, GEORGE R. R.",Adult,Adult,18,3,0
487,The Wonderful Things You Will Be,Emily Winfield Martin,"8,842",4.9,$10.00,2016,Fiction,THE WONDERFUL THINGS YOU WILL BE,(blank),,EMILY WINFIELD MARTIN,"MARTIN, WINFIELD EMILY",CH,Not_adult,6,4,0
180,If Animals Kissed Good Night,Ann Whitford Paul,"16,643",4.8,$4.00,2019,Fiction,IF ANIMALS KISSED GOOD NIGHT,(blank),,ANN WHITFORD PAUL,"PAUL, WHITFORD ANN",CH,Not_adult,5,2,2
179,If Animals Kissed Good Night,Ann Whitford Paul,"16,643",4.8,$4.00,2017,Fiction,IF ANIMALS KISSED GOOD NIGHT,(blank),,ANN WHITFORD PAUL,"PAUL, WHITFORD ANN",CH,Not_adult,5,2,2
3,12 Rules for Life: An Antidote to Chaos,Jordan B. Peterson,"18,979",4.7,$15.00,2018,Non Fiction,12 RULES FOR LIFE: AN ANTIDOTE TO CHAOS,(blank),,JORDAN B. PETERSON,"PETERSON, B. JORDAN",Adult,Adult,8,1,1
493,The Wright Brothers,David McCullough,"6,169",4.7,$16.00,2015,Non Fiction,THE WRIGHT BROTHERS,(blank),,DAVID MCCULLOUGH,"MCCULLOUGH, DAVID",Adult,Adult,3,1,0
446,The Paris Wife: A Novel,Paula McLain,"3,759",4.3,$16.00,2011,Fiction,THE PARIS WIFE: A NOVEL,(blank),,PAULA MCLAIN,"MCLAIN, PAULA",Adult,Adult,5,1,0
86,Dog Man: Fetch-22: From the Creator of Captain Underpants (Dog Man #8),Dav Pilkey,"12,619",4.9,$8.00,2019,Fiction,DOG MAN: FETCH-22: FROM THE CREATOR OF CAPTAIN UNDERPANTS,Dog Man,8,DAV PILKEY,"PILKEY, DAV",CH,Not_adult,9,7,7
498,Thomas Jefferson: The Art of Power,Jon Meacham,"1,904",4.5,$23.00,2012,Non Fiction,THOMAS JEFFERSON: THE ART OF POWER,(blank),,JON MEACHAM,"MEACHAM, JON",Adult,Adult,6,1,0
87,Dog Man: For Whom the Ball Rolls: From the Creator of Captain Underpants (Dog Man #7),Dav Pilkey,"9,089",4.9,$8.00,2019,Fiction,DOG MAN: FOR WHOM THE BALL ROLLS: FROM THE CREATOR OF CAPTAIN UNDERPANTS,Dog Man,7,DAV PILKEY,"PILKEY, DAV",CH,Not_adult,13,7,7
152,Hamilton: The Revolution,Lin-Manuel Miranda,"5,867",4.9,$54.00,2016,Non Fiction,HAMILTON: THE REVOLUTION,(blank),,LIN-MANUEL MIRANDA,"MIRANDA, LIN-MANUEL",Adult,Adult,3,1,0
403,The Help,Kathryn Stockett,"13,871",4.8,$6.00,2009,Fiction,THE HELP,(blank),,KATHRYN STOCKETT,"STOCKETT, KATHRYN",Adult,Adult,2,4,0
319,The 17 Day Diet: A Doctor's Plan Designed for Rapid Results,Mike Moreno,"2,314",4.3,$22.00,2011,Non Fiction,THE 17 DAY DIET: A DOCTOR'S PLAN DESIGNED FOR RAPID RESULTS,(blank),,MIKE MORENO,"MORENO, MIKE",Adult,Adult,11,1,0
418,The Last Lecture,Randy Pausch,"4,028",4.7,$9.00,2009,Non Fiction,THE LAST LECTURE,(blank),,RANDY PAUSCH,"PAUSCH, RANDY",Adult,Adult,3,1,0
500,Three Cups of Tea: One Man's Mission to Promote Peace - One School at a Time,Greg Mortenson,"3,319",4.3,$11.00,2010,Non Fiction,THREE CUPS OF TEA: ONE MAN'S MISSION TO PROMOTE PEACE - ONE SCHOOL AT A TIME,(blank),,GREG MORTENSON,"MORTENSON, GREG",Adult,Adult,16,2,0
528,What If?: Serious Scientific Answers to Absurd Hypothetical Questions,Randall Munroe,"9,292",4.7,$17.00,2014,Non Fiction,WHAT IF?: SERIOUS SCIENTIFIC ANSWERS TO ABSURD HYPOTHETICAL QUESTIONS,(blank),,RANDALL MUNROE,"MUNROE, RANDALL",Adult,Adult,9,1,0
224,Love You Forever,Robert Munsch,"18,613",4.8,$5.00,2014,Fiction,LOVE YOU FOREVER,(blank),,ROBERT MUNSCH,"MUNSCH, ROBERT",CH,Not_adult,3,2,0
225,Love You Forever,Robert Munsch,"18,613",4.8,$5.00,2015,Fiction,LOVE YOU FOREVER,(blank),,ROBERT MUNSCH,"MUNSCH, ROBERT",CH,Not_adult,3,2,0
531,What to Expect When You're Expecting,Heidi Murkoff,"3,341",4.4,$9.00,2011,Non Fiction,WHAT TO EXPECT WHEN YOU'RE EXPECTING,(blank),,HEIDI MURKOFF,"MURKOFF, HEIDI",Adult,Adult,6,1,0
,Dog Man: Brawl of the Wild,Dav Pilkey,"17,195",4.9,$6.48,2019,Fiction,BRAWL OF THE WILD,Dog Man,6,"PILKEY, DAV","PILKEY, DAV",CH,Not_adult,4,7,7
419,"The Last Olympian (Percy Jackson and the Olympians, Book 5)",Rick Riordan,"4,628",4.8,$7.00,2009,Fiction,THE LAST OLYMPIAN,Percy Jackson and the Olympians,5,RICK RIORDAN,"RIORDAN, RICK",YA,Not_adult,8,11,0
82,Dog Man and Cat Kid: From the Creator of Captain Underpants (Dog Man #4),Dav Pilkey,"5,062",4.9,$6.00,2018,Fiction,DOG MAN AND CAT KID: FROM THE CREATOR OF CAPTAIN UNDERPANTS,Dog Man,4,DAV PILKEY,"PILKEY, DAV",CH,Not_adult,11,7,7
83,Dog Man: A Tale of Two Kitties: From the Creator of Captain Underpants (Dog Man #3),Dav Pilkey,"4,786",4.9,$8.00,2017,Fiction,DOG MAN: A TALE OF TWO KITTIES: FROM THE CREATOR OF CAPTAIN UNDERPANTS,Dog Man,3,DAV PILKEY,"PILKEY, DAV",CH,Not_adult,13,7,7
350,The Book with No Pictures,B. J. Novak,"8,081",4.8,$8.00,2014,Fiction,THE BOOK WITH NO PICTURES,(blank),,B. J. NOVAK,"NOVAK, J. B.",CH,Not_adult,5,2,0
351,The Book with No Pictures,B. J. Novak,"8,081",4.8,$8.00,2015,Fiction,THE BOOK WITH NO PICTURES,(blank),,B. J. NOVAK,"NOVAK, J. B.",CH,Not_adult,5,2,0
198,Killing Kennedy: The End of Camelot,Bill O'Reilly,"8,634",4.6,$25.00,2012,Non Fiction,KILLING KENNEDY: THE END OF CAMELOT,Bill O'Reilly's Killing Series,,BILL O'REILLY,"O'REILLY, BILL",Adult,Adult,6,7,0
84,Dog Man: Brawl of the Wild: From the Creator of Captain Underpants (Dog Man #6),Dav Pilkey,"7,235",4.9,$4.00,2018,Fiction,DOG MAN: BRAWL OF THE WILD: FROM THE CREATOR OF CAPTAIN UNDERPANTS,Dog Man,6,DAV PILKEY,"PILKEY, DAV",CH,Not_adult,12,7,7
88,Dog Man: Lord of the Fleas: From the Creator of Captain Underpants (Dog Man #5),Dav Pilkey,"5,470",4.9,$6.00,2018,Fiction,DOG MAN: LORD OF THE FLEAS: FROM THE CREATOR OF CAPTAIN UNDERPANTS,Dog Man,5,DAV PILKEY,"PILKEY, DAV",CH,Not_adult,12,7,7
244,No Easy Day: The Autobiography of a Navy Seal: The Firsthand Account of the Mission That Killed Osama Bin Laden,Mark Owen,"8,093",4.6,$14.00,2012,Non Fiction,NO EASY DAY: THE AUTOBIOGRAPHY OF A NAVY SEAL: THE FIRSTHAND ACCOUNT OF THE MISSION THAT KILLED OSAMA BIN LADEN,(blank),,MARK OWEN,"OWEN, MARK",Adult,Adult,20,1,0
75,Difficult Riddles For Smart Kids: 300 Difficult Riddles And Brain Teasers Families Will Love (Books for Smart Kids),M Prefontaine,"7,955",4.6,$5.00,2019,Non Fiction,DIFFICULT RIDDLES FOR SMART KIDS: 300 DIFFICULT RIDDLES AND BRAIN TEASERS FAMILIES WILL LOVE,Books for Smart Kids,,M PREFONTAINE,"PREFONTAINE, M",CH,Not_adult,18,1,1
541,Wonder,R. J. Palacio,"21,625",4.8,$9.00,2013,Fiction,WONDER,(blank),,R. J. PALACIO,"PALACIO, J. R.",CH,Not_adult,1,5,0
542,Wonder,R. J. Palacio,"21,625",4.8,$9.00,2014,Fiction,WONDER,(blank),,R. J. PALACIO,"PALACIO, J. R.",CH,Not_adult,1,5,0
543,Wonder,R. J. Palacio,"21,625",4.8,$9.00,2015,Fiction,WONDER,(blank),,R. J. PALACIO,"PALACIO, J. R.",CH,Not_adult,1,5,0
544,Wonder,R. J. Palacio,"21,625",4.8,$9.00,2016,Fiction,WONDER,(blank),,R. J. PALACIO,"PALACIO, J. R.",CH,Not_adult,1,5,0
139,Good Days Start With Gratitude: A 52 Week Guide To Cultivate An Attitude Of Gratitude: Gratitude Journal,Pretty Simple Press,"10,141",4.6,$6.00,2019,Non Fiction,GOOD DAYS START WITH GRATITUDE: A 52 WEEK GUIDE TO CULTIVATE AN ATTITUDE OF GRATITUDE: GRATITUDE JOURNAL,(blank),,PRETTY SIMPLE PRESS,PRETTY SIMPLE PRESS,Adult,Adult,17,1,1
73,"The Last Straw: Diary of a Wimpy Kid, Book 3 (Diary of a Wimpy Kid)",Jeff Kinney,"3,837",4.8,$15.00,2009,Fiction,THE LAST STRAW: DIARY OF A WIMPY KID,Diary of a Wimpy Kid,3,JEFF KINNEY,"KINNEY, JEFF",CH,Not_adult,13,12,0
114,First 100 Words,Roger Priddy,"17,323",4.7,$4.00,2017,Non Fiction,FIRST 100 WORDS,(blank),,ROGER PRIDDY,"PRIDDY, ROGER",CH,Not_adult,3,5,5
430,The Lost Symbol,Dan Brown,"8,747",4.2,$19.00,2009,Fiction,THE LOST SYMBOL,(blank),,DAN BROWN,"BROWN, DAN",Adult,Adult,3,3,0
115,First 100 Words,Roger Priddy,"17,323",4.7,$4.00,2018,Non Fiction,FIRST 100 WORDS,(blank),,ROGER PRIDDY,"PRIDDY, ROGER",CH,Not_adult,3,5,5
304,Strange Planet (Strange Planet Series),Nathan W. Pyle,"9,382",4.9,$6.00,2019,Fiction,STRANGE PLANET,Strange Planet Series,,NATHAN W. PYLE,"PYLE, W. NATHAN",Adult,Adult,5,1,1
357,The Complete Ketogenic Diet for Beginners: Your Essential Guide to Living the Keto Lifestyle,Amy Ramos,"13,061",4.3,$6.00,2019,Non Fiction,THE COMPLETE KETOGENIC DIET FOR BEGINNERS: YOUR ESSENTIAL GUIDE TO LIVING THE KETO LIFESTYLE,(blank),,AMY RAMOS,"RAMOS, AMY",Adult,Adult,14,2,2
431,The Love Dare,Stephen Kendrick,"1,655",4.8,$13.00,2009,Non Fiction,THE LOVE DARE,(blank),,STEPHEN KENDRICK,"KENDRICK, STEPHEN",Adult,Adult,3,1,0
149,"Grain Brain: The Surprising Truth about Wheat, Carbs, and Sugar--Your Brain's Silent Killers",David Perlmutter MD,"5,972",4.6,$10.00,2014,Non Fiction,"GRAIN BRAIN: THE SURPRISING TRUTH ABOUT WHEAT, CARBS, AND SUGAR--YOUR BRAIN'S SILENT KILLERS",(blank),,DAVID PERLMUTTER MD,"PERLMUTTER, DAVID",Adult,Adult,13,1,0
356,The Complete Ketogenic Diet for Beginners: Your Essential Guide to Living the Keto Lifestyle,Amy Ramos,"13,061",4.3,$6.00,2018,Non Fiction,THE COMPLETE KETOGENIC DIET FOR BEGINNERS: YOUR ESSENTIAL GUIDE TO LIVING THE KETO LIFESTYLE,(blank),,AMY RAMOS,"RAMOS, AMY",Adult,Adult,14,2,2
46,Capital in the Twenty First Century,Thomas Piketty,"2,884",4.5,$28.00,2014,Non Fiction,CAPITAL IN THE TWENTY FIRST CENTURY,(blank),,THOMAS PIKETTY,"PIKETTY, THOMAS",Adult,Adult,6,1,0
473,The Total Money Makeover: Classic Edition: A Proven Plan for Financial Fitness,Dave Ramsey,"11,550",4.7,$10.00,2019,Non Fiction,THE TOTAL MONEY MAKEOVER: CLASSIC EDITION: A PROVEN PLAN FOR FINANCIAL FITNESS,(blank),,DAVE RAMSEY,"RAMSEY, DAVE",Adult,Adult,12,1,1
416,The Instant Pot Electric Pressure Cooker Cookbook: Easy Recipes for Fast & Healthy Meals,Laurel Randolph,"7,368",4.3,$7.00,2017,Non Fiction,THE INSTANT POT ELECTRIC PRESSURE COOKER COOKBOOK: EASY RECIPES FOR FAST & HEALTHY MEALS,(blank),,LAUREL RANDOLPH,"RANDOLPH, LAUREL",Adult,Adult,14,2,2
417,The Instant Pot Electric Pressure Cooker Cookbook: Easy Recipes for Fast & Healthy Meals,Laurel Randolph,"7,368",4.3,$7.00,2018,Non Fiction,THE INSTANT POT ELECTRIC PRESSURE COOKER COOKBOOK: EASY RECIPES FOR FAST & HEALTHY MEALS,(blank),,LAUREL RANDOLPH,"RANDOLPH, LAUREL",Adult,Adult,14,2,2
157,"Harry Potter and the Prisoner of Azkaban: The Illustrated Edition (Harry Potter, Book 3)",J. K. Rowling,"3,146",4.9,$30.00,2017,Fiction,HARRY POTTER AND THE PRISONER OF AZKABAN: THE ILLUSTRATED EDITION,Harry Potter,,J. K. ROWLING,"ROWLING, J. K.",YA,Not_adult,12,8,8
156,"Harry Potter and the Goblet of Fire: The Illustrated Edition (Harry Potter, Book 4) (4)",J. K. Rowling,"7,758",4.9,$18.00,2019,Fiction,HARRY POTTER AND THE GOBLET OF FIRE: THE ILLUSTRATED EDITION,Harry Potter,,J. K. ROWLING,"ROWLING, J. K.",YA,Not_adult,12,8,8
379,The Four Agreements: A Practical Guide to Personal Freedom (A Toltec Wisdom Book),Don Miguel Ruiz,"23,308",4.7,$6.00,2017,Non Fiction,THE FOUR AGREEMENTS: A PRACTICAL GUIDE TO PERSONAL FREEDOM,(blank),,DON MIGUEL RUIZ,"RUIZ, MIGUEL DON",Adult,Adult,13,6,6
91,Drive: The Surprising Truth About What Motivates Us,Daniel H. Pink,"2,525",4.5,$16.00,2010,Non Fiction,DRIVE: THE SURPRISING TRUTH ABOUT WHAT MOTIVATES US,(blank),,DANIEL H. PINK,"PINK, DANIEL R.",Adult,Adult,8,1,0
285,Radical: Taking Back Your Faith from the American Dream,David Platt,"1,985",4.7,$9.00,2010,Non Fiction,RADICAL: TAKING BACK YOUR FAITH FROM THE AMERICAN DREAM,(blank),,DAVID PLATT,"PLATT, DAVID",Adult,Adult,9,2,0
286,Radical: Taking Back Your Faith from the American Dream,David Platt,"1,985",4.7,$9.00,2011,Non Fiction,RADICAL: TAKING BACK YOUR FAITH FROM THE AMERICAN DREAM,(blank),,DAVID PLATT,"PLATT, DAVID",Adult,Adult,9,2,0
116,Food Rules: An Eater's Manual,Michael Pollan,"1,555",4.4,$9.00,2010,Non Fiction,FOOD RULES: AN EATER'S MANUAL,(blank),,MICHAEL POLLAN,"POLLAN, MICHAEL",Adult,Adult,5,1,0
380,The Four Agreements: A Practical Guide to Personal Freedom (A Toltec Wisdom Book),Don Miguel Ruiz,"23,308",4.7,$6.00,2018,Non Fiction,THE FOUR AGREEMENTS: A PRACTICAL GUIDE TO PERSONAL FREEDOM,(blank),,DON MIGUEL RUIZ,"RUIZ, MIGUEL DON",Adult,Adult,13,6,6
111,First 100 Words,Roger Priddy,"17,323",4.7,$4.00,2014,Non Fiction,FIRST 100 WORDS,(blank),,ROGER PRIDDY,"PRIDDY, ROGER",CH,Not_adult,3,5,0
112,First 100 Words,Roger Priddy,"17,323",4.7,$4.00,2015,Non Fiction,FIRST 100 WORDS,(blank),,ROGER PRIDDY,"PRIDDY, ROGER",CH,Not_adult,3,5,0
113,First 100 Words,Roger Priddy,"17,323",4.7,$4.00,2016,Non Fiction,FIRST 100 WORDS,(blank),,ROGER PRIDDY,"PRIDDY, ROGER",CH,Not_adult,3,5,0
381,The Four Agreements: A Practical Guide to Personal Freedom (A Toltec Wisdom Book),Don Miguel Ruiz,"23,308",4.7,$6.00,2019,Non Fiction,THE FOUR AGREEMENTS: A PRACTICAL GUIDE TO PERSONAL FREEDOM,(blank),,DON MIGUEL RUIZ,"RUIZ, MIGUEL DON",Adult,Adult,13,6,6
258,"Option B: Facing Adversity, Building Resilience, and Finding Joy",Sheryl Sandberg,"1,831",4.5,$9.00,2017,Non Fiction,"OPTION B: FACING ADVERSITY, BUILDING RESILIENCE, AND FINDING JOY",(blank),,SHERYL SANDBERG,"SANDBERG, SHERYL",Adult,Adult,9,2,2
7,A Game of Thrones / A Clash of Kings / A Storm of Swords / A Feast of Crows / A Dance with Dragons (A Song of Ice and Fire),George R. R. Martin,"19,735",4.7,$30.00,2014,Fiction,A GAME OF THRONES / A CLASH OF KINGS / A STORM OF SWORDS / A FEAST OF CROWS / A DANCE WITH DRAGONS,A Song of Ice and Fire,1-5,GEORGE R. R. MARTIN,"R., R. GEORGE",Adult,Adult,24,2,0
253,"Oh, the Places You'll Go!",Dr. Seuss,"21,834",4.9,$8.00,2019,Fiction,"OH, THE PLACES YOU'LL GO!",(blank),,DR. SEUSS,"SEUSS, DR.",CH,Not_adult,5,9,9
251,"Oh, the Places You'll Go!",Dr. Seuss,"21,834",4.9,$8.00,2017,Fiction,"OH, THE PLACES YOU'LL GO!",(blank),,DR. SEUSS,"SEUSS, DR.",CH,Not_adult,5,9,9
252,"Oh, the Places You'll Go!",Dr. Seuss,"21,834",4.9,$8.00,2018,Fiction,"OH, THE PLACES YOU'LL GO!",(blank),,DR. SEUSS,"SEUSS, DR.",CH,Not_adult,5,9,9
241,National Geographic Little Kids First Big Book of Why (National Geographic Little Kids First Big Books),Amy Shields,"7,866",4.8,$11.00,2019,Non Fiction,NATIONAL GEOGRAPHIC LITTLE KIDS FIRST BIG BOOK OF WHY,National Geographic Little Kids First Big Books,,AMY SHIELDS,"SHIELDS, AMY",CH,Not_adult,16,1,1
523,Unicorn Coloring Book: For Kids Ages 4-8 (US Edition) (Silly Bear Coloring Books),Silly Bear,"6,108",4.8,$4.00,2019,Non Fiction,UNICORN COLORING BOOK: FOR KIDS AGES 4-8,"US Edition, Silly Bear Coloring Books",,SILLY BEAR,SILLY BEAR,CH,Not_adult,13,1,1
194,JOURNEY TO THE ICE P,RH Disney,978,4.6,$5.29,2014,Fiction,JOURNEY TO THE ICE PALACE,(blank),,RH DISNEY,RH Disney,CH,Not_adult,5,2,0
218,Life,Keith Richards,"2,752",4.5,$18.00,2010,Non Fiction,LIFE,(blank),,KEITH RICHARDS,"RICHARDS, KEITH",Adult,Adult,1,1,0
147,"Goodnight, Goodnight Construction Site (Hardcover Books for Toddlers, Preschool Books for Kids)",Sherri Duskey Rinker,"7,038",4.9,$7.00,2012,Fiction,GOODNIGHT,"Hardcover Books for Toddlers, Preschool Books for Kids",,SHERRI DUSKEY RINKER,"RINKER, DUSKEY SHERRI",CH,Not_adult,1,2,0
148,"Goodnight, Goodnight Construction Site (Hardcover Books for Toddlers, Preschool Books for Kids)",Sherri Duskey Rinker,"7,038",4.9,$7.00,2013,Fiction,GOODNIGHT,"Hardcover Books for Toddlers, Preschool Books for Kids",,SHERRI DUSKEY RINKER,"RINKER, DUSKEY SHERRI",CH,Not_adult,1,2,0
265,Percy Jackson and the Olympians Paperback Boxed Set (Books 1-3),Rick Riordan,548,4.8,$2.00,2010,Fiction,PERCY JACKSON AND THE OLYMPIANS PAPERBACK BOXED SET,Percy Jackson and the Olympians,1-3,RICK RIORDAN,"RIORDAN, RICK",YA,Not_adult,9,11,0
153,"Happy, Happy, Happy: My Life and Legacy as the Duck Commander",Phil Robertson,"4,148",4.8,$11.00,2013,Non Fiction,"HAPPY, HAPPY, HAPPY: MY LIFE AND LEGACY AS THE DUCK COMMANDER",(blank),,PHIL ROBERTSON,"ROBERTSON, PHIL",Adult,Adult,11,1,0
293,Sarah's Key,Tatiana de Rosnay,"3,619",4.6,$10.00,2010,Fiction,SARAH'S KEY,(blank),,TATIANA DE ROSNAY,"ROSNAY, DE TATIANA",Adult,Adult,2,1,0
540,Women Food and God: An Unexpected Path to Almost Everything,Geneen Roth,"1,302",4.2,$11.00,2010,Non Fiction,WOMEN FOOD AND GOD: AN UNEXPECTED PATH TO ALMOST EVERYTHING,(blank),,GENEEN ROTH,"ROTH, GENEEN",Adult,Adult,10,1,0
155,"Harry Potter and the Cursed Child, Parts 1 & 2, Special Rehearsal Edition Script",J. K. Rowling,"23,973",4.0,$12.00,2016,Fiction,"HARRY POTTER AND THE CURSED CHILD, PARTS 1 & 2, SPECIAL REHEARSAL EDITION SCRIPT",Harry Potter,,J. K. ROWLING,"ROWLING, J. K.",YA,Not_adult,14,8,0
160,Harry Potter Paperback Box Set (Books 1-7),J. K. Rowling,"13,471",4.8,$52.00,2016,Fiction,HARRY POTTER PAPERBACK BOX SET,HARRY POTTER,107,J. K. ROWLING,"ROWLING, J. K.",YA,Not_adult,5,8,0
354,The Casual Vacancy,J. K. Rowling,"9,372",3.3,$12.00,2012,Fiction,THE CASUAL VACANCY,(blank),,J. K. ROWLING,"ROWLING, J. K.",YA,Not_adult,3,8,0
214,"Lean In: Women, Work, and the Will to Lead",Sheryl Sandberg,"6,132",4.5,$13.00,2013,Non Fiction,"LEAN IN: WOMEN, WORK, AND THE WILL TO LEAD",(blank),,SHERYL SANDBERG,"SANDBERG, SHERYL",Adult,Adult,9,2,0
548,You Are a Badass: How to Stop Doubting Your Greatness and Start Living an Awesome Life,Jen Sincero,"14,331",4.7,$8.00,2017,Non Fiction,YOU ARE A BADASS: HOW TO STOP DOUBTING YOUR GREATNESS AND START LIVING AN AWESOME LIFE,(blank),,JEN SINCERO,"SINCERO, JEN",Adult,Adult,16,4,4
220,Little Blue Truck,Alice Schertle,"1,884",4.9,$4.70,2014,Fiction,LITTLE BLUE TRUCK,(blank),,ALICE SCHERTLE,"SCHERTLE, ALICE",CH,Not_adult,3,1,0
159,Harry Potter Coloring Book,Scholastic,"3,564",4.7,$9.00,2015,Non Fiction,HARRY POTTER COLORING BOOK,Harry Potter,,SCHOLASTIC,SCHOLASTIC,CH,Not_adult,4,2,0
269,Pokémon Deluxe Essential Handbook: The Need-to-Know Stats and Facts on Over 700 Pokémon,Scholastic,"3,503",4.7,$9.00,2016,Fiction,POKÉMON DELUXE ESSENTIAL HANDBOOK: THE NEED-TO-KNOW STATS AND FACTS ON OVER 700 POKÉMON,(blank),,SCHOLASTIC,SCHOLASTIC,CH,Not_adult,13,2,0
12,A Patriot's History of the United States: From Columbus's Great Discovery to the War on Terror,Larry Schweikart,460,4.6,$2.00,2010,Non Fiction,A PATRIOT'S HISTORY OF THE UNITED STATES: FROM COLUMBUS'S GREAT DISCOVERY TO THE WAR ON TERROR,(blank),,LARRY SCHWEIKART,"SCHWEIKART, LARRY",Adult,Adult,16,1,0
460,The Shack: Where Tragedy Confronts Eternity,William P. Young,"19,720",4.6,$8.00,2009,Fiction,THE SHACK: WHERE TRAGEDY CONFRONTS ETERNITY,(blank),,WILLIAM P. YOUNG,"YOUNG, P. WILLIAM",Adult,Adult,6,2,0
246,"Oh, the Places You'll Go!",Dr. Seuss,"21,834",4.9,$8.00,2012,Fiction,"OH, THE PLACES YOU'LL GO!",(blank),,DR. SEUSS,"SEUSS, DR.",CH,Not_adult,5,9,0
247,"Oh, the Places You'll Go!",Dr. Seuss,"21,834",4.9,$8.00,2013,Fiction,"OH, THE PLACES YOU'LL GO!",(blank),,DR. SEUSS,"SEUSS, DR.",CH,Not_adult,5,9,0
248,"Oh, the Places You'll Go!",Dr. Seuss,"21,834",4.9,$8.00,2014,Fiction,"OH, THE PLACES YOU'LL GO!",(blank),,DR. SEUSS,"SEUSS, DR.",CH,Not_adult,5,9,0
249,"Oh, the Places You'll Go!",Dr. Seuss,"21,834",4.9,$8.00,2015,Fiction,"OH, THE PLACES YOU'LL GO!",(blank),,DR. SEUSS,"SEUSS, DR.",CH,Not_adult,5,9,0
250,"Oh, the Places You'll Go!",Dr. Seuss,"21,834",4.9,$8.00,2016,Fiction,"OH, THE PLACES YOU'LL GO!",(blank),,DR. SEUSS,"SEUSS, DR.",CH,Not_adult,5,9,0
549,You Are a Badass: How to Stop Doubting Your Greatness and Start Living an Awesome Life,Jen Sincero,"14,331",4.7,$8.00,2018,Non Fiction,YOU ARE A BADASS: HOW TO STOP DOUBTING YOUR GREATNESS AND START LIVING AN AWESOME LIFE,(blank),,JEN SINCERO,"SINCERO, JEN",Adult,Adult,16,4,4
550,You Are a Badass: How to Stop Doubting Your Greatness and Start Living an Awesome Life,Jen Sincero,"14,331",4.7,$8.00,2019,Non Fiction,YOU ARE A BADASS: HOW TO STOP DOUBTING YOUR GREATNESS AND START LIVING AN AWESOME LIFE,(blank),,JEN SINCERO,"SINCERO, JEN",Adult,Adult,16,4,4
491,The Wonky Donkey,Craig Smith,"30,183",4.8,$4.00,2018,Fiction,THE WONKY DONKEY,(blank),,CRAIG SMITH,"SMITH, CRAIG",CH,Not_adult,3,2,2
471,The Time Traveler's Wife,Audrey Niffenegger,"3,759",4.4,$6.00,2009,Fiction,THE TIME TRAVELER'S WIFE,(blank),,AUDREY NIFFENEGGER,"NIFFENEGGER, AUDREY",Adult,Adult,4,1,0
